"id_all","Headline","codeN","missword","sampleloc"
51284,"梶山静六氏が死去　元官房長官・元自民幹事長",NA,NA,9733
25732,"サハリン残留韓国人の帰国支援を拡大　日韓会談で細川首相が表明へ",NA,NA,5451
51555,"第２次森内閣きょう発足　運輸に森田氏など、陣容ほぼ確定 ",NA,NA,9777
27160,"広範な黒字削減策迫る　クリストファー米国務長官、細川首相と会談",NA,NA,5806
41241,"井奥代議士、国土次官時に国有地取得　歴代内閣が不動産取引自粛の中",NA,NA,8244
81210,"公務員人材センター　「年内稼働」麻生首相、改革に全力／衆院委 ",NA,NA,14063
68995,"日中首脳会談　対話促進で一致　小泉首相、暴力防止求める ",NA,NA,12410
24121,"宮沢首相、政治改革法案成立「今国会」を断念　自民内調整できず",NA,NA,5055
10901,"ソ連大統領、９１年の早い時期に来日　海部首相が講演で見通し",NA,NA,2192
73328,"靖国神社　小泉首相、終戦記念日のきょう参拝予定 ",NA,NA,12912
43923,"橋本首相、所得減税を明言　課税最低限は維持　財源には言及せず",NA,NA,8645
8692,"米、対中関係改善へ　補佐官が北京入りし銭外相と会談　「経済・政治、進展を」 ",NA,NA,1683
7596,"日米構造協議は１年間かけ最終報告　海部首相、首脳会談終え見解 ",NA,NA,1494
